{
  "$schema": "http://json-schema.org/draft-07/schema#",
  "$id": "https://github.com/software-description-language/spec/dependency.schema.json",
  "title": "SDL Dependency",
  "description": "A Dependency is an external resource that this service calls or reads from — another service, a database, a cache, an event broker, or a third-party API. Dependencies are DL inter-Container Connect candidates: by reading all services' declared dependencies, a synthesis tool can reconstruct the cross-service Connect graph at the parent Container level without manual authoring. Each Dependency declares which client class wraps it, what calls are made, and how failures are handled.",
  "type": "object",
  "dl": {
    "profile": "software",
    "version": "0.1",
    "concepts": ["Connect"],
    "layer": "semantic",
    "notes": "Dependency = candidate inter-Container Connect. The Connect is materialized by a synthesis tool at the parent Container level. The service (child Container) declares its outbound dependencies; the parent Container owns the actual Connect."
  },
  "required": ["id", "kind", "label"],
  "additionalProperties": false,
  "properties": {
    "id": {
      "type": "string",
      "description": "Unique kebab-case identifier for this dependency within the service.",
      "pattern": "^[a-z0-9][a-z0-9-_]*[a-z0-9]$",
      "examples": ["inventory-service-client", "orders-db", "kafka-producer", "stripe-client"]
    },
    "kind": {
      "type": "string",
      "description": "What category of external resource this is. See stdlib/dependency-kinds.json for ai_hint per kind.",
      "enum": [
        "service",
        "database",
        "cache",
        "message-broker",
        "object-storage",
        "external-api",
        "identity-provider",
        "custom"
      ]
    },
    "label": {
      "type": "string",
      "description": "Human-readable name for this dependency.",
      "examples": ["Inventory Service Client", "Orders PostgreSQL", "Kafka Producer", "Stripe API Client"]
    },
    "description": {
      "type": "string",
      "description": "What this dependency provides and why this service uses it."
    },
    "interface": {
      "type": "object",
      "description": "How this service calls the dependency — protocol and specific operations invoked.",
      "properties": {
        "protocol": {
          "type": "string",
          "description": "The communication protocol used.",
          "enum": ["rest", "grpc", "graphql", "database", "redis", "kafka", "rabbitmq", "sqs", "pubsub", "nats", "smtp", "s3", "custom"],
          "examples": ["rest", "database", "kafka"]
        },
        "calls": {
          "type": "array",
          "description": "The specific operations or endpoints this service invokes on the dependency.",
          "items": {
            "type": "object",
            "required": ["label"],
            "additionalProperties": false,
            "properties": {
              "label": {
                "type": "string",
                "description": "Human-readable description of this call.",
                "examples": ["GET /inventory/{id}", "checkStock method", "Publish to order.created topic", "INSERT into orders table"]
              },
              "method_ref": {
                "type": "string",
                "description": "The client method or function name used to make this call, as it appears in the codebase.",
                "examples": ["inventoryClient.checkStock", "ordersRepo.insert", "kafkaProducer.publish"]
              },
              "style": {
                "type": "string",
                "enum": ["sync", "async"],
                "description": "Whether this call is synchronous (caller waits for response) or asynchronous (fire-and-forget or event-driven)."
              },
              "purpose": {
                "type": "string",
                "description": "Why this call is made in plain language."
              },
              "shape_ref": {
                "type": "string",
                "description": "The id of the DataShape describing the payload sent or received in this call. Must reference a valid data-shape id in data-shapes.sdl.json.",
                "examples": ["create-order-request", "payment-completed-event"]
              }
            }
          }
        }
      },
      "additionalProperties": false
    },
    "reliability": {
      "type": "object",
      "description": "How this service handles failures from this dependency.",
      "properties": {
        "timeout_ms": {
          "type": "integer",
          "minimum": 0,
          "description": "Timeout in milliseconds before the call is considered failed.",
          "examples": [5000, 30000]
        },
        "retry": {
          "type": "boolean",
          "description": "Whether failed calls are automatically retried."
        },
        "circuit_breaker": {
          "type": "boolean",
          "description": "Whether a circuit breaker is applied to calls to this dependency."
        },
        "fallback": {
          "type": "string",
          "description": "What happens if this dependency is unavailable.",
          "examples": ["Return cached value", "Fail fast with 503", "Queue for retry", "Degrade gracefully — skip non-critical enrichment"]
        }
      },
      "additionalProperties": false
    },
    "client_ref": {
      "type": "object",
      "description": "The client class or module in the codebase that wraps this dependency.",
      "properties": {
        "name": {
          "type": "string",
          "description": "Class or module name.",
          "examples": ["InventoryServiceClient", "OrdersRepository", "KafkaProducer"]
        },
        "file_ref": {
          "type": "string",
          "description": "Path to the client file, relative to repo root.",
          "examples": ["src/clients/inventory.client.ts", "internal/repository/orders.go"]
        }
      },
      "additionalProperties": false
    },
    "tags": {
      "type": "array",
      "items": { "type": "string" },
      "examples": [["critical-path", "circuit-breakered", "pci-scope", "read-only"]]
    },
    "meta": {
      "type": "object",
      "additionalProperties": true
    }
  }
}
